{"authority":"checked-in-source-fixture","base_contract":{"compiled_pack_path":"Content/World/Generated/GlassScar/glass_scar_compiled_map_pack_v1.json","compiled_pack_sha256":"6dbbe2f1a5bd7faec122e6050e5c2d27d4d56e3e94da357b239673ec4b6ab621"},"claim_boundary":{"not_evidence_for":["runtime consumption or spawning of this data","gameplay meaning of any placed record","final art, materials, or texture quality","composed framing, lighting design, or authored levels","package, performance, or release readiness"],"proposed_contract":true},"deferred_classes":[{"deferred_reason":"Elevation is not modelled: vision and movement cost ignore height and height_band_ordinal is consumed by nothing, so ridge geometry implies a tactical affordance the simulation does not provide. Authoring more ridge dressing would deepen the existing Bible rule-3 readability defect recorded 2026-09-02. This class stays deferred until the elevation gameplay ruling lands.","id":"basin_ridge","mesh_reference":"/Game/Art/Generated/World/Environment/SM_World_GlassScarRidge"}],"dressing_classes":[{"id":"glass_shard","mesh_reference":"/Game/Art/Generated/World/Environment/SM_World_GlassScarShard","occluder":true,"permitted_cell_state":"blocked","reads_as":"impassable black-glass shard"},{"id":"vitrified_shelf","mesh_reference":"/Game/Art/Generated/World/Environment/SM_World_GlassScarShelf","occluder":true,"permitted_cell_state":"blocked","reads_as":"impassable vitrified shelf"}],"grid":{"cell_count":4096,"coordinate_origin":"southwest","height_tiles":64,"index_formula":"y*width+x","width_tiles":64},"pack_format":"echoes-map-dressing-pack","pack_version":1,"runtime_binding":"none","schema_version":1,"sites":[{"empty_reason":"No bespoke environment meshes exist for this site. The owner-adopted grounding is an early coherent Hollow Choir incursion site, which calls for repeated near-identical geometry with deliberate local contradictions rather than Glass Scar's vitrified vocabulary. Left empty until Visual authors a Choir-incursion mesh family.","id":"confluence-ring","record_count":0,"records":[],"vocabulary_status":"empty"},{"empty_reason":"No bespoke environment meshes exist for this site; every registered environment mesh is a Glass Scar family asset. Reusing them here is what makes the three maps read as one place, so this vocabulary is deliberately left empty until Visual authors a Crownfall mesh family.","id":"crownfall-basin","record_count":0,"records":[],"vocabulary_status":"empty"},{"id":"glass-scar","record_count":29,"records":[{"cell_index":1992,"class":"glass_shard","id":"drs_gs_shard_01","orientation_ordinal":3,"scale_band":2,"x":8,"y":31},{"cell_index":2006,"class":"glass_shard","id":"drs_gs_shard_02","orientation_ordinal":1,"scale_band":2,"x":22,"y":31},{"cell_index":2020,"class":"glass_shard","id":"drs_gs_shard_03","orientation_ordinal":3,"scale_band":2,"x":36,"y":31},{"cell_index":2027,"class":"glass_shard","id":"drs_gs_shard_04","orientation_ordinal":0,"scale_band":2,"x":43,"y":31},{"cell_index":2056,"class":"glass_shard","id":"drs_gs_shard_05","orientation_ordinal":0,"scale_band":0,"x":8,"y":32},{"cell_index":2070,"class":"glass_shard","id":"drs_gs_shard_06","orientation_ordinal":2,"scale_band":0,"x":22,"y":32},{"cell_index":2084,"class":"glass_shard","id":"drs_gs_shard_07","orientation_ordinal":0,"scale_band":0,"x":36,"y":32},{"cell_index":2091,"class":"glass_shard","id":"drs_gs_shard_08","orientation_ordinal":1,"scale_band":0,"x":43,"y":32},{"cell_index":2120,"class":"glass_shard","id":"drs_gs_shard_09","orientation_ordinal":1,"scale_band":1,"x":8,"y":33},{"cell_index":2134,"class":"glass_shard","id":"drs_gs_shard_10","orientation_ordinal":3,"scale_band":1,"x":22,"y":33},{"cell_index":2148,"class":"glass_shard","id":"drs_gs_shard_11","orientation_ordinal":1,"scale_band":1,"x":36,"y":33},{"cell_index":2155,"class":"glass_shard","id":"drs_gs_shard_12","orientation_ordinal":2,"scale_band":1,"x":43,"y":33},{"cell_index":1928,"class":"vitrified_shelf","id":"drs_gs_shelf_01","orientation_ordinal":2,"scale_band":1,"x":8,"y":30},{"cell_index":1936,"class":"vitrified_shelf","id":"drs_gs_shelf_02","orientation_ordinal":2,"scale_band":2,"x":16,"y":30},{"cell_index":1940,"class":"vitrified_shelf","id":"drs_gs_shelf_03","orientation_ordinal":2,"scale_band":2,"x":20,"y":30},{"cell_index":1944,"class":"vitrified_shelf","id":"drs_gs_shelf_04","orientation_ordinal":2,"scale_band":0,"x":24,"y":30},{"cell_index":1948,"class":"vitrified_shelf","id":"drs_gs_shelf_05","orientation_ordinal":2,"scale_band":0,"x":28,"y":30},{"cell_index":1956,"class":"vitrified_shelf","id":"drs_gs_shelf_06","orientation_ordinal":2,"scale_band":1,"x":36,"y":30},{"cell_index":1960,"class":"vitrified_shelf","id":"drs_gs_shelf_07","orientation_ordinal":2,"scale_band":2,"x":40,"y":30},{"cell_index":1964,"class":"vitrified_shelf","id":"drs_gs_shelf_08","orientation_ordinal":2,"scale_band":2,"x":44,"y":30},{"cell_index":1972,"class":"vitrified_shelf","id":"drs_gs_shelf_09","orientation_ordinal":2,"scale_band":0,"x":52,"y":30},{"cell_index":2186,"class":"vitrified_shelf","id":"drs_gs_shelf_10","orientation_ordinal":0,"scale_band":1,"x":10,"y":34},{"cell_index":2194,"class":"vitrified_shelf","id":"drs_gs_shelf_11","orientation_ordinal":0,"scale_band":2,"x":18,"y":34},{"cell_index":2198,"class":"vitrified_shelf","id":"drs_gs_shelf_12","orientation_ordinal":0,"scale_band":2,"x":22,"y":34},{"cell_index":2202,"class":"vitrified_shelf","id":"drs_gs_shelf_13","orientation_ordinal":0,"scale_band":0,"x":26,"y":34},{"cell_index":2214,"class":"vitrified_shelf","id":"drs_gs_shelf_14","orientation_ordinal":0,"scale_band":1,"x":38,"y":34},{"cell_index":2218,"class":"vitrified_shelf","id":"drs_gs_shelf_15","orientation_ordinal":0,"scale_band":2,"x":42,"y":34},{"cell_index":2222,"class":"vitrified_shelf","id":"drs_gs_shelf_16","orientation_ordinal":0,"scale_band":2,"x":46,"y":34},{"cell_index":2230,"class":"vitrified_shelf","id":"drs_gs_shelf_17","orientation_ordinal":0,"scale_band":0,"x":54,"y":34}],"vocabulary_status":"populated"}],"source_provenance":{"path":"Content/World/Source/GlassScar/glass_scar_dressing_v1.json","raw_sha256":"93423179a58f6a2c2692be3033ef23ffdfea4b4761e4f0d9eda0bff61025e6de"},"total_record_count":29}