{"authority":"checked-in-source-fixture","base_contract":{"compiled_pack_path":"Content/World/Generated/Overlays/overlay_map_packs_v1.json","compiled_pack_sha256":"95e187ec51bc0aa5e4998c7da9be025e3ba0c728736df160a20823df6ccf47d5"},"claim_boundary":{"not_evidence_for":["runtime consumption or spawning of this data","gameplay meaning of any placed record","final art, materials, or texture quality","composed framing, lighting design, or authored levels","package, performance, or release readiness"],"proposed_contract":true},"deferred_classes":[{"deferred_reason":"Elevation is not modelled: vision and movement cost ignore height, so causeway ramps imply tactical affordances the simulation does not provide. Left deferred until the elevation ruling lands.","id":"elevation_causeway","mesh_reference":"/Game/Art/Generated/World/Environment/SM_World_GlassScarRidge"}],"dressing_classes":[{"id":"civic_frame","mesh_reference":"/Game/Art/Generated/World/Environment/SM_World_GlassScarShelf","occluder":true,"permitted_cell_state":"blocked","reads_as":"pale-ceramic civic frame bastion"},{"id":"conduit_pylon","mesh_reference":"/Game/Art/Generated/World/Environment/SM_World_GlassScarShard","occluder":true,"permitted_cell_state":"blocked","reads_as":"interrupted civic conduit pylon"}],"grid":{"cell_count":4096,"coordinate_origin":"southwest","height_tiles":64,"index_formula":"y*width+x","width_tiles":64},"pack_format":"echoes-map-dressing-pack","pack_version":1,"runtime_binding":"none","schema_version":1,"sites":[{"id":"lume-reach","record_count":39,"records":[{"cell_index":1865,"class":"civic_frame","id":"drs_lr_frame_01","orientation_ordinal":0,"scale_band":1,"x":9,"y":29},{"cell_index":1868,"class":"civic_frame","id":"drs_lr_frame_02","orientation_ordinal":2,"scale_band":2,"x":12,"y":29},{"cell_index":1870,"class":"civic_frame","id":"drs_lr_frame_03","orientation_ordinal":0,"scale_band":1,"x":14,"y":29},{"cell_index":1878,"class":"civic_frame","id":"drs_lr_frame_04","orientation_ordinal":1,"scale_band":2,"x":22,"y":29},{"cell_index":1881,"class":"civic_frame","id":"drs_lr_frame_05","orientation_ordinal":3,"scale_band":1,"x":25,"y":29},{"cell_index":1883,"class":"civic_frame","id":"drs_lr_frame_06","orientation_ordinal":1,"scale_band":2,"x":27,"y":29},{"cell_index":1893,"class":"civic_frame","id":"drs_lr_frame_07","orientation_ordinal":3,"scale_band":2,"x":37,"y":29},{"cell_index":1896,"class":"civic_frame","id":"drs_lr_frame_08","orientation_ordinal":1,"scale_band":1,"x":40,"y":29},{"cell_index":1898,"class":"civic_frame","id":"drs_lr_frame_09","orientation_ordinal":3,"scale_band":2,"x":42,"y":29},{"cell_index":1907,"class":"civic_frame","id":"drs_lr_frame_10","orientation_ordinal":0,"scale_band":2,"x":51,"y":29},{"cell_index":1910,"class":"civic_frame","id":"drs_lr_frame_11","orientation_ordinal":2,"scale_band":1,"x":54,"y":29},{"cell_index":2389,"class":"civic_frame","id":"drs_lr_frame_12","orientation_ordinal":1,"scale_band":2,"x":21,"y":37},{"cell_index":2519,"class":"civic_frame","id":"drs_lr_frame_13","orientation_ordinal":0,"scale_band":2,"x":23,"y":39},{"cell_index":2773,"class":"civic_frame","id":"drs_lr_frame_14","orientation_ordinal":1,"scale_band":1,"x":21,"y":43},{"cell_index":2411,"class":"civic_frame","id":"drs_lr_frame_15","orientation_ordinal":2,"scale_band":2,"x":43,"y":37},{"cell_index":2537,"class":"civic_frame","id":"drs_lr_frame_16","orientation_ordinal":3,"scale_band":1,"x":41,"y":39},{"cell_index":2666,"class":"civic_frame","id":"drs_lr_frame_17","orientation_ordinal":1,"scale_band":2,"x":42,"y":41},{"cell_index":2792,"class":"civic_frame","id":"drs_lr_frame_18","orientation_ordinal":0,"scale_band":1,"x":40,"y":43},{"cell_index":1800,"class":"conduit_pylon","id":"drs_lr_pylon_01","orientation_ordinal":1,"scale_band":0,"x":8,"y":28},{"cell_index":1930,"class":"conduit_pylon","id":"drs_lr_pylon_02","orientation_ordinal":3,"scale_band":1,"x":10,"y":30},{"cell_index":1805,"class":"conduit_pylon","id":"drs_lr_pylon_03","orientation_ordinal":1,"scale_band":0,"x":13,"y":28},{"cell_index":1935,"class":"conduit_pylon","id":"drs_lr_pylon_04","orientation_ordinal":3,"scale_band":1,"x":15,"y":30},{"cell_index":1812,"class":"conduit_pylon","id":"drs_lr_pylon_05","orientation_ordinal":2,"scale_band":2,"x":20,"y":28},{"cell_index":1940,"class":"conduit_pylon","id":"drs_lr_pylon_06","orientation_ordinal":0,"scale_band":1,"x":20,"y":30},{"cell_index":1821,"class":"conduit_pylon","id":"drs_lr_pylon_07","orientation_ordinal":2,"scale_band":1,"x":29,"y":28},{"cell_index":1949,"class":"conduit_pylon","id":"drs_lr_pylon_08","orientation_ordinal":0,"scale_band":2,"x":29,"y":30},{"cell_index":1827,"class":"conduit_pylon","id":"drs_lr_pylon_09","orientation_ordinal":0,"scale_band":2,"x":35,"y":28},{"cell_index":1955,"class":"conduit_pylon","id":"drs_lr_pylon_10","orientation_ordinal":2,"scale_band":1,"x":35,"y":30},{"cell_index":1836,"class":"conduit_pylon","id":"drs_lr_pylon_11","orientation_ordinal":0,"scale_band":1,"x":44,"y":28},{"cell_index":1964,"class":"conduit_pylon","id":"drs_lr_pylon_12","orientation_ordinal":2,"scale_band":2,"x":44,"y":30},{"cell_index":1841,"class":"conduit_pylon","id":"drs_lr_pylon_13","orientation_ordinal":3,"scale_band":1,"x":49,"y":28},{"cell_index":1969,"class":"conduit_pylon","id":"drs_lr_pylon_14","orientation_ordinal":1,"scale_band":2,"x":49,"y":30},{"cell_index":1844,"class":"conduit_pylon","id":"drs_lr_pylon_15","orientation_ordinal":3,"scale_band":0,"x":52,"y":28},{"cell_index":1975,"class":"conduit_pylon","id":"drs_lr_pylon_16","orientation_ordinal":1,"scale_band":1,"x":55,"y":30},{"cell_index":2392,"class":"conduit_pylon","id":"drs_lr_pylon_17","orientation_ordinal":3,"scale_band":1,"x":24,"y":37},{"cell_index":2646,"class":"conduit_pylon","id":"drs_lr_pylon_18","orientation_ordinal":2,"scale_band":1,"x":22,"y":41},{"cell_index":2776,"class":"conduit_pylon","id":"drs_lr_pylon_19","orientation_ordinal":3,"scale_band":2,"x":24,"y":43},{"cell_index":2408,"class":"conduit_pylon","id":"drs_lr_pylon_20","orientation_ordinal":0,"scale_band":1,"x":40,"y":37},{"cell_index":2795,"class":"conduit_pylon","id":"drs_lr_pylon_21","orientation_ordinal":2,"scale_band":2,"x":43,"y":43}],"vocabulary_status":"populated"}],"source_provenance":{"path":"Content/World/Source/LumeReach/lume_reach_dressing_v1.json","raw_sha256":"3a072b8ec4f5984aa8cdeffdcdf8750e26196833137aba839e107eda7c8203c7"},"total_record_count":39}